139,"ἀθανάτοιο πατρός τε ὁμόχρονε, πάμπαν ὁμοῖε...","ἀ#θα#νά#τοι#ο πα#τρός τε ὁ#μόχ#ρο#νε, πάμ#παν ὁ#μοῖ#ε...",,"ἀθανάτοιο πατρός τε ὁμόχρονε, πάμπαν ὁμοῖε...",20,3,hex,DDDDDT ,,D,D,D,D,D,T,5,0,,,,,5F,,B,3F,5F,,,,,1,,1,M,,,,,,,1,,,,,,,1,6,,_3 4 5 6,,,
140,"Παῖ, γέρον, αἰώνων προγενέστερε, πατρὸς ὁμῆλιξ…","Παῖ, γέ#ρον, αἰ#ώ#νων προ#γε#νέσ#τε#ρε, πατ#ρὸς ὁ#μῆ#λιξ…",,"Παῖ, γέρον, αἰώνων προγενέστερε, πατρὸς ὁμῆλιξ...",21,1,hex,DSDDDS ,,D,S,D,D,D,S,4,1,,,,,,,B,,5M,,1,,,1,,2,,,,,,,,1,,,,,,,1,6,,_1 4 6 ,,,
141,"Πατρὸς ἐπουρανίου λόγε πάνσοφε, κοίρανε κόσμου,","Πατ#ρὸς ἐ#που#ρα#νί#ου λό#γε πάν#σο#φε, κοί#ρα#νε κόσ#μου,",,"Πατρὸς ἐπουρανίου λόγε πάνσοφε, κοίρανε κόσμου,",22,1,hex,DDDDDS ,,D,D,D,D,D,S,5,0,,,,,,,B,,5M,,,,1,1,1,3,,,,,,,1,,,,,1,,,,6,,_4 5 6,,,
142,"ὁ βροτέην γενεὴν τιμήσας εἰκόνι σεῖο,","ὁ βρο#τέ#ην γε#νε#ὴν τι#μή#σας εἰ#κό#νι σεῖ#ο,",,"ὁ βροτέην γενεὴν τιμήσας εἰκόνι σεῖο,",22,2,hex,DDSSDT ,,D,D,S,S,D,T,3,2,,,,,,,B,3M,5M,,,,,1,1,2,,,,,,,1,,,,,,,,1,6,,_3 4 6,,,
143,σὴν χάριν ἄμμιν ὄπαζε καὶ ὀλβιόδωρον ἀρωγήν·,σὴν χά#ριν ἄμ#μιν ὄ#πα#ζε καὶ ὀλ#βι#ό#δω#ρον ἀ#ρω#γήν·,,σὴν χάριν ἄμμιν ὄπαζε καὶ ὀλβιόδωρον ἀρωγὴν·,22,3,hex,DDDDDS ,,D,D,D,D,D,S,5,0,,,,,5F,,,,5F,,1,,,,,1,M,,,,,,,1,,,1,,,,,7,,_1 2 ,,,
144,εἰς σὲ γὰρ εἰσορόωσιν ἐν ἐλπίσιν ὄμματα πάντων.,εἰς σὲ γὰρ εἰ#σο#ρό#ω#σιν ἐν ἐλ#πί#σιν ὄμ#μα#τα πάν#των.,,εἰς σὲ γὰρ εἰσορόωσιν ἐν ἐλπίσιν ὄμματα πάντων.,22,4,hex,DDDDDS ,,D,D,D,D,D,S,5,0,,,,,5F,,B,,5F,,1,,1,1,1,4,,,,,,,1,,,,,1,,,,8,,_5 6,,,
145,"Ἀθανάτου πατρὸς υἱὲ συνάχρονε, κοίρανε πάντων,","Ἀ#θα#νά#του πα#τρὸς υἱ#ὲ συ#νάχ#ρο#νε, κοί#ρα#νε πάν#των,",,"Ἀθανάτου πατρὸς υἱὲ συνάχρονε, κοίρανε πάντων,",23,1,distih,DDDDDS ,,D,D,D,D,D,S,5,0,,,,,,,B,3M,5F,,,1,,1,1,3,,,,,,,1,,,,,1,,,,7,,_4 5 6,,,
146,"δμωῒ τεῷ, τῷ τήνδε βίβλον γράψαντι Μαρίνῳ,","δμω#ῒ τε#ῷ, τῷ τήν#δε βί#βλον γρά#ψαν#τι Μα#ρί#νῳ,",,"δμωῒ τεῷ, τῷ τήνδε βίβλον γράψαντι Μαρίνῳ,",23,3,distih,DSDSDS ,,D,S,D,S,D,S,3,2,,,,3M,,,,,5F,7M,,,,,,0,,,,H?,,,,1,,,,1,,,,8,,_2 3 6,,,
147,"Σύνθρονε καὶ συνάναρχε τεῷ πατρὶ πνεύματί τ’ ἐσθλῷ,","Σύν#θρο#νε καὶ συ#νά#ναρ#χε τε#ῷ πα#τρὶ πνεύ#μα#τί τ’ ἐσ#θλῷ,",,"Σύνθρονε καὶ συνάναρχε τεῷ πατρὶ πνεύματί τ’ ἐσθλῷ,",24,1,hex,DDDDDS ,,D,D,D,D,D,S,5,0,,,,,5F,,,3M,5F,7M,1,,,1,1,3,,,,,,,1,,,,,,,1,,8,,_1 2 4 5,,,
148,"οἰχομένων ὄντων τε καὶ ἐσσομένων βασιλεύων,","οἰ#χο#μέ#νων ὄν#των τε καὶ ἐσ#σο#μέ#νων βα#σι#λεύ#ων,",,"οἰχομένων ὄντων τε καὶ ἐσσομένων βασιλεύων,",24,2,hex,DSDDDS ,,D,S,D,D,D,S,4,1,,,,,5F,,,3M,5F,,,,1,,,1,,,,,,,,,1,,,1,,,,6,,_6,,,
149,"τῷ ταῦτα γράψαντι τεὴν χάριν αὐτὸς ὀπάζοις,","τῷ ταῦ#τα γρά#ψαν#τι τε#ὴν χά#ριν αὐ#τὸς ὀ#πά#ζοις,",,"τῷ ταῦτα γράψαντι τεὴν χάριν αὐτὸς ὀπάζοις,",24,3,hex,SSDDDS ,,S,S,D,D,D,S,3,2,,,,,5M,,,3M,5M,,,,,1,,1,,,,,,,,1,,,,1,,,,7,,_1 4 6,,,
150,ὄφρα κε σῇς ἐφετμῇσι καλῶς βίου οἶμον ὁδεύοι.,ὄφ#ρα κε σῇς ἐ#φετ#μῇ#σι κα#λῶς βί#ου οἶ#μον ὁ#δεύ#οι.,,ὄφρα κε σῇς ἐφετμῇσι καλῶς βίου οἶμον ὁδεύοι./SCURTĂ,24,4,hex,DDDDDS ,,D,D,D,D,D,S,5,0,,,,,5F,,,3M,5F,7M,1,,,1,,2,,,,,,,,1,,,,1,,,,8,,_1 2 3 4 5 6,,,
151,"Χριστέ, θεοῦ σοφίη, κόσμου μεδέων καὶ ἀνάσσων,","Χρισ#τέ, θε#οῦ σο#φί#η, κόσ#μου με#δέ#ων καὶ ἀ#νάσ#σων,",,"Χριστέ, θεοῦ σοφίη, κόσμου μεδέων καὶ ἀνάσσων,",25,1,hex,DDSDDS ,,D,D,S,D,D,S,4,1,,,1F,,5M,,,3M,5M,7M,,,,,,0,,,,,,,,1,,,,1,,,,7,,_2 6,,,
152,"ἡμετέρην τὸ πάροιθε πλάσας μεροπηΐδα φύτλην,","ἡ#με#τέ#ρην τὸ πά#ροι#θε πλά#σας με#ρο#πη#ΐ#δα φύτ#λην,",,"ἡμετέρην τὸ πάροιθε πλάσας μεροπηΐδα φύτλην,",25,2,hex,DDDDDS ,,D,D,D,D,D,S,5,0,,,,,5F,,,3M,5F,7M,,,,,1,1,M?,,,,,,1,,,,,1,,,,6,,_6,,,
153,δός με θέειν βίου οἶμον ἐν ὑμετέραις ἐφετμῇσι.,δός με θέ#ειν βί#ου οἶ#μον ἐν ὑ#με#τέ#ραις ἐ#φετ#μῇ#σι.,,δός με θέειν βίου οἶμον ἐν ὑμετέραις ἐφετμῇσι.SCURTĂ,25,3,hex,DDDDDT ,,D,D,D,D,D,T,5,0,,,,,5F,,,3M,5F,,,1,1,,,2,,,,,,,,,1,,,,,,1,8,,_1 3 6,,,
154,"Ὑψιμέδων θεοῦ υἱέ, φαεσφόρον ἀΐδιον φῶς,","Ὑ#ψι#μέ#δων θε#οῦ υἱ#έ, φα#εσ#φό#ρον ἀ#ΐ#δι#ον φῶς,","Ὑψιμέδων θεοῦ υἱέ, φωσφόρον ἀΐδιον φῶς,","Ὑψιμέδων θεοῦ υἱέ, φαεσφόρον ἀΐδιον φῶς,",26,1,hex,DDDDDS ,,D,D,D,D,D,S,5,0,,,,,5F,,,3M,5F,,,,,1,,1,,,,,,1,,,,,,,,1,,6,,_,,,
155,"σήν μοι ὄπαζε χάριν καὶ νῦν καὶ ἔπειτα καὶ αἰεί,","σήν μοι ὄ#πα#ζε χά#ριν καὶ νῦν καὶ ἔ#πει#τα καὶ αἰ#εί,","σήν μοι ὤπαζε χάριν καὶ νῦν καὶ ἔπειτα καὶ αἰεί,","σήν μοι ὄπαζε χάριν καὶ νῦν καὶ ἔπειτα καὶ αἰεί,LUNGĂ/SCURTĂ",26,2,hex,DDSDDS ,,D,D,S,D,D,S,4,1,,,,,5M,,,3F,5M,7M,,,1,,1,2,,H,,,,,1,,,,1,,,,,7,,_1 4 ,,,
156,ὡς προθέλυμνον ἐοῦσαν ὅτῳ καὶ ὅπῃ κατανεύσεις.,ὡς προ#θέ#λυμ#νον ἐ#οῦ#σαν ὅ#τῳ καὶ ὅ#πῃ κα#τα#νεύ#σεις.,ὡς προθέλυμνον ὄυσαν οὕτω καὶ ὅπῃ κατανεύσεις.,ὡς προθέλυμνον ἐοῦσαν ὅτῳ καὶ ὅπῃ κατανεύσεις.,26,3,hex,DDDDDS ,,D,D,D,D,D,S,5,0,,,,,5F,,,3F,5F,,,,,,,0,,H,,,,,,,1,,,1,,,,7,,_3 6,,,
157,"Πανσθενὲς υἱὲ θεοῦ, Χριστέ, προάναρχε ἁπάντων,","Παν#σθε#νὲς υἱ#ὲ θε#οῦ, Χρισ#τέ, προ#ά#ναρ#χε ἁ#πάν#των,",,"Πανσθενὲς υἱὲ θεοῦ, Χριστέ, προάναρχε ἁπάντων,",27,1,hex,DDSDDS ,,D,D,S,D,D,S,4,1,,,,,5M,7M,,,5M,7M,1,,,,,1,M,,,,,,,1,,,,1,,,,6,,_3 4 6,,,
158,"πᾶσιν ἐπιχθονίοις σωτήρια νάματα βλύζων,","πᾶ#σιν ἐ#πιχ#θο#νί#οις σω#τή#ρι#α νά#μα#τα βλύ#ζων,",,"πᾶσιν ἐπιχθονίοις σωτήρια νάματα βλύζων,",27,2,hex,DDSDDS ,,D,D,S,D,D,S,4,1,,,,,5M,,,,5M,,,,,1,1,2,,,,,,,1,,,,,1,,,,5,,_1 4 5 6,,,
159,"μητρὸς ἀπειρογάμοιο τεῆς λιτέων ἐπακούων,","μητ#ρὸς ἀ#πει#ρο#γά#μοι#ο τε#ῆς λι#τέ#ων ἐ#πα#κού#ων,",,"μητρὸς ἀπειρογάμοιο τεῆς λιτέων ἐπακούων,",27,3,hex,DDDDDS ,,D,D,D,D,D,S,5,0,,,,,5F,,,,5F,7M,,,,,,0,,,,,,,,,1,,,1,,,,5,,_4 6,,,
160,σὴν χάριν ἄμμιν ὄπαζε καὶ ἐν μύθοις καὶ ἐν ἔργοις.,σὴν χά#ριν ἄμ#μιν ὄ#πα#ζε καὶ ἐν μύ#θοις καὶ ἐν ἔρ#γοις.,,σὴν χάριν ἄμμιν ὄπαζε καὶ ἐν μύθοις καὶ ἐν ἔργοις.,27,4,hex,DDDSDS ,,D,D,D,S,D,S,4,1,,,,,5F,,,3F,5F,,1,,1,,1,3,M,,,,,,1,,,,,1,,,,10,,_1 6,,,
161,"Xριστέ, θεοῦ σοφίη, χάριν ἔμπασον εὐεπιάων","Xρισ#τέ, θε#οῦ σο#φί#η, χά#ριν ἔμ#πα#σον εὐ#ε#πι#ά#ων",,"Xριστέ, θεοῦ σοφίη, χάριν ἔμπασον εὐεπιάων",28,1,distih,DDDDDS ,,D,D,D,D,D,S,5,0,,,1F,,5M,,,3M,5M,,,,1,1,,2,,,,,,,,,,1,,1,,,,6,,_1 2 6,,,
162,"ὃς τόδε τεῦχος ἔγραψεν ἑαῖς χείρεσσι Μαρῖνος,","ὃς τό#δε τεῦ#χος ἔ#γρα#ψεν ἑ#αῖς χεί#ρεσ#σι Μα#ρῖ#νος,","ὃς τόδε τεῦχος ἔγραψεν ἑαῖς χερσὶ Μαρῖνος,","ὃς τόδε τεῦχος ἔγραψεν ἑαῖς χείρεσσι Μαρῖνος,",28,3,distih,DDDSDT ,,D,D,D,S,D,T,4,1,,,,,5F,,,3F,5F,,1,,,,,1,M,,,,,,,1,,,,,,,1,7,,_1 2 4 6,,,
163,"Χριστέ, τεὴν προΐαλλε χάριν καμάτοισιν ἐμεῖο.","Χρισ#τέ, τε#ὴν προ#ΐ#αλ#λε χά#ριν κα#μά#τοι#σιν ἐ#μεῖ#ο.","Χριστέ, τεὴν προῒ ἄλλοις χάριν καμάτοισιν ἐμεῖο.","Χριστέ, τεὴν προΐαλλε χάριν καμάτοισιν ἐμεῖο.",29,1,hex,DDDDDT ,,D,D,D,D,D,T,5,0,,,1F,,,7M,,3M,5F,7M,,,,,,0,,,,,,,,1,,,,,,,1,6,,_2 6,,,
164,Ὁ Χριστὸς καὶ ἐμοῖς ἐπιτάῤῥοθος ἔσσεται ἔργοις.,Ὁ Χρισ#τὸς καὶ ἐ#μοῖς ἐ#πι#τάῤ#ῥο#θος ἔσ#σε#ται ἔρ#γοις.,,Ὁ Χριστὸς καὶ ἐμοῖς ἐπιτάῤῥοθος ἔσσεται ἔργοις.,29,2,hex,SDDDDS ,,S,D,D,D,D,S,4,1,,,,,,,B,3M,5M,,,,,1,1,2,M,,,,,,1,,,,,1,,,,7,,_2 3 4 5 6,,,
165,Χριστὸς ἐμοῖς καμάτοισιν ἀρηγόνα χεῖρα τιταίνοι.,Χρισ#τὸς ἐ#μοῖς κα#μά#τοι#σιν ἀ#ρη#γό#να χεῖ#ρα τι#ταί#νοι.,,Χριστὸς ἐμοῖς καμάτοισιν ἀρηγόνα χεῖρα τιταίνοι.,29,3,hex,DDDDDS ,,D,D,D,D,D,S,5,0,,,,,5F,,,3M,5F,,,,,1,,1,,,,,,,,1,,,,1,,,,6,,_2 5 6,,,
166,"Χριστέ, σύ μοι προΐαλλε τεὴν πολύολβον ἀρωγήν.","Χρισ#τέ, σύ μοι προ#ΐ#αλ#λε τε#ὴν πο#λύ#ολ#βον ἀ#ρω#γήν.",,"Χριστέ, σύ μοι προΐαλλε τεὴν πολύολβον ἀρωγήν.",29,4,hex,DDDDDS ,,D,D,D,D,D,S,5,0,,,1F,,5F,,,3M,5F,,1,,,,,1,,,,,,,,1,,,1,,,,,7,,_4,,,
167,"Χριστέ, τεὴν καμάτοισιν ἐμοῖς χάριν αὐτὸς ὀπάζοις.","Χρισ#τέ, τε#ὴν κα#μά#τοι#σιν ἐ#μοῖς χά#ριν αὐ#τὸς ὀ#πά#ζοις.",,"Χριστέ, τεὴν καμάτοισιν ἐμοῖς χάριν αὐτὸς ὀπάζοις.",29,5,hex,DDDDDS,,D,D,D,D,D,S,5,0,,,1F,,,,B,3M,5F,7M,,,,1,,1,,,,,,,,1,,,,1,,,,7,,_2 4 6,,,
168,"Χριστὲ μάκαρ, μερόπων φάος ἄφθιτον, ἐλπὶς ἁπάντων,","Χρισ#τὲ μά#καρ, με#ρό#πων φά#ος ἄφ#θι#τον, ἐλ#πὶς ἁ#πάν#των,",,"Χριστὲ μάκαρ, μερόπων φάος ἄφθιτον, ἐλπὶς ἁπάντων,",30,1,hex,DDDDDS ,,D,D,D,D,D,S,5,0,,,,3M,,,B,3M,5M,7F,,,1,1,,2,,,,,,,,1,,,,1,,,,7,,_4 6,,,
169,"ἐσθλὰ δίδου χατέουσι, τὰ δ’ οὐ καλὰ νόσφιν ἐρύκοις.","ἐσ#θλὰ δί#δου χα#τέ#ου#σι, τὰ δ’ οὐ κα#λὰ νόσ#φιν ἐ#ρύ#κοις.",,"ἐσθλὰ δίδου χατέουσι, τὰ δ’ οὐ καλὰ νόσφιν ἐρύκοις.",30,2,hex,DDDDDS ,,D,D,D,D,D,S,5,0,,,,,5F,,,3M,5F,,,,1,1,,2,,,,,,,,1,,,,1,,,,9,,_5 6,,,
170,"Παμμεδέοντα, ἄνασσα, θεοῖο γόνον, τεόν υἱόν,","Παμ#με#δέ#ον#τα, ἄ#νασ#σα, θε#οῖ#ο γό#νον, τε#όν υἱ#όν,",,"Παμμεδέοντα, ἄνασσα, θεοῖο γόνον, τεόν υἱόν,",31,1,hex,DDDDDT ,,D,D,D,D,D,T,5,0,,,,3F,5F,,,3F,5F,7F,,,,,1,1,M,H,,,,,1,,,,1,,,,,6,,_4,,,
171,"ἄγγελοι ὃν τρομέουσι, τεῇς παλάμῃσι κρατοῦσα,","ἄγ#γε#λοι ὃν τρο#μέ#ου#σι, τε#ῇς πα#λά#μῃ#σι κρα#τοῦ#σα,",,"ἄγγελοι ὃν τρομέουσι, τεῇς παλάμῃσι κρατοῦσα,",31,2,hex,DDDDDT ,,D,D,D,D,D,T,5,0,,,,,5F,,,3M,5F,7M,1,,,,,1,,,,,,,,1,,,,,,,1,6,,_1 2 4 6,,,
172,"πρευμενέα πραπίδεσσιν ὑπὲρ μερόπων τελέουσα,","πρευ#με#νέ#α πρα#πί#δεσ#σιν ὑ#πὲρ με#ρό#πων τε#λέ#ου#σα,",,"πρευμενέα πραπίδεσσιν ὑπὲρ μερόπων τελέουσα,",31,3,hex,DDDDDT ,,D,D,D,D,D,T,5,0,,,,,5F,,,3M,5F,,,,,,,0,,,,,,,,,1,,,,1,,,5,,_4,,,
173,ῥύεο συντηροῦσα ἀπήμονα κόσμον ἅπαντα.,ῥύ#ε#ο συν#τη#ροῦ#σα ἀ#πή#μο#να κόσ#μον ἅ#παν#τα.,,ῥύεο συντηροῦσα ἀπήμονα κόσμον ἅπαντα.,31,4,hex,DSDDDT,,D,S,D,D,D,T,4,1,,,,,,,B,,5F,,1,,,1,,2,,,,,,,,1,,,,,1,,,5,,_1 3 4 5,,,
174,"Ὥδε ταλαιπαθέων χραισμήϊα θέσκελα κεῖται,","Ὥ#δε τα#λαι#πα#θέ#ων χραισ#μή#ϊ#α θέσ#κε#λα κεῖ#ται,",,"Ὥδε ταλαιπαθέων χραισμήϊα θέσκελα κεῖται,",32,1,distih,DDSDDS ,,D,D,S,D,D,S,4,1,,,,,5M,,,,5M,,,,,1,1,2,,,,,,,1,,,,,,,,1,7,,_1 4 5 6,,,
175,καὶ γὰρ ἀνιάζουσα πόνων φύσις αὐτίκα φεύγει,καὶ γὰρ ἀ#νι#ά#ζου#σα πό#νων φύ#σις αὐ#τί#κα φεύ#γει,,καὶ γὰρ ἀνιάζουσα πόνων φύσις αὐτίκα φεύγει,32,3,distih,DSDDDS ,,D,S,D,D,D,S,4,1,,,,,5F,,,,5F,7M,,,,1,1,2,,,,,,,1,,,,,1,,,,7,,_6,,,
176,Ὡς θρασὺ μορφῶσαι τὸν ἀσώματον. Ἀλλὰ καὶ εἰκὼν,Ὡς θρα#σὺ μορ#φῶ#σαι τὸν ἀ#σώ#μα#τον. Ἀλ#λὰ καὶ εἰ#κὼν,,"Ὡς θρασὺ μορφῶσαι τὸν ἀσώματον, ἀλλὰ καὶ εἰκὼν",33,1,distih,DSDDDS ,,D,S,D,D,D,S,4,1,,,,,,,B,,5M,,1,,,1,1,3,,,,,,,1,,,,1,,,,,8,,_4,,,
177,"Ἄσκοπον ἀγγελίαρχον, ἀσώματον εἴδεϊ μορφῆς ‒","Ἄσ#κο#πον ἀγ#γε#λί#αρ#χον, ἀ#σώ#μα#τον εἴ#δε#ϊ μορ#φῆς ‒",,"Ἄσκοπον ἀγγελίαρχον ἀσώματον εἴδεϊ μορφῆς,",34,1,distih,DDDDDS ,,D,D,D,D,D,S,5,0,,,,,,,B,,5F,,1,,,1,1,3,,,,,,,1,,,,,,,1,,5,,_1 4 5 ,,,
178,"Ἔμπης οὐκ ἀχάριστον, ἐπεὶ βροτὸς εἰκόνα λεύσσων","Ἔμ#πης οὐκ ἀ#χά#ρισ#τον, ἐ#πεὶ βρο#τὸς εἰ#κό#να λεύσ#σων",,"ἔμπης οὐκ ἀχάριστον, ἐπεὶ βροτὸς εἰκόνα λεύσσων",34,3,distih,SDDDDS ,,S,D,D,D,D,S,4,1,,,,,5F,,,,5F,,1,,,1,1,3,,,,,,,1,,,,,1,,,,7,,_1 4 6,,,
179,"οὐκέτι δ’ ἀλλοπρόσαλλον ἔχει σέβας, ἀλλ’ ἐν ἑαυτῷ","οὐ#κέ#τι δ’ ἀλ#λο#πρό#σαλ#λον ἔ#χει σέ#βας, ἀλ#λ’ ἐν ἑ#αυ#τῷ",,"οὐκέτι δ’ ἀλλοπρόσαλλον ἔχει σέβας, ἀλλ’ ἐν ἑαυτῷ",34,5,distih,DDDDDS ,,D,D,D,D,D,S,5,0,,,,,,,B,,5F,7M,1,,,1,,2,,,,,,,,1,,,,,,1,,8,,_,,,
180,ὄμματα δ’ ὀτρύνουσι βαθὺν νόον· οἶδε δὲ τέχνη,ὄμ#μα#τα δ’ ὀτ#ρύ#νου#σι βα#θὺν νό#ον· οἶ#δε δὲ τέχ#νη,,ὄμματα δ’ ὀτρύνουσι βαθὺν νόον· οἶδε δὲ τέχνη,34,7,distih,DSDDDS ,,D,S,D,D,D,S,4,1,,,,,,,B,,5F,7M,1,,,1,1,3,,,,,,,1,,,,,1,,,,8,,_1  4 5 6,,,
181,"Καρικὸς Αἰμιλιανὸς Ἰωάννης τε σὺν αὐτῷ,","Κα#ρι#κὸς Αἰ#μι#λι#α#νὸς Ἰ#ω#άν#νης τε σὺν αὐ#τῷ,",,"Καρικὸς Αἰμιλιανὸς, Ἰωάννης τε σὺν αὐτῷ,",35,1,distih,DDDSDS ,,D,D,D,S,D,S,4,1,,,,,5F,,,,5F,,1,,,,1,2,,,,,,,1,,,,,,,1,,6,,_,,,
182,"τέτρατον, ἀγγελίαρχε, νόμων λυκάβαντα λαχόντες","τέτ#ρα#τον, ἀγ#γε#λί#αρ#χε, νό#μων λυ#κά#βαν#τα λα#χόν#τες",,"τέτρατον, ἀγγελίαρχε, νόμων λυκάβαντα λαχόντες,",35,3,distih,DDDDDT ,,D,D,D,D,D,T,5,0,,,,,5F,,,,5F,7M,1,,,,,1,,,,,,,,1,,,,1,,,,5,,_1  6,,,
183,αἰτοῦντες τὸν ἔπειτα καλὸν χρόνον. Ἀλλὰ φανείης,αἰ#τοῦν#τες τὸν ἔ#πει#τα κα#λὸν χρό#νον. Ἀλ#λὰ φα#νεί#ης,,αἰτοῦντες τὸν ἔπειτα καλὸν χρόνον· ἀλλὰ φανείης,35,5,distih,SDDDDS ,,S,D,D,D,D,S,4,1,,,,,,,B,3M,5F,7M,,,,1,,1,M?,,,,,,,1,,,,1,,,,7,,_4 6,,,
184,"Ἵλαθι μορφωθείς, ἀρχάγγελε. Σὴ γὰρ ὀπωπὴ","Ἵ#λα#θι μορ#φω#θείς, ἀρ#χάγ#γε#λε. Σὴ γὰρ ὀ#πω#πὴ",,"Ἵλαθι μορφωθείς, ἀρχάγγελε· σὴ γὰρ ὀπωπὴ",36,1,distih,DSSDDS ,,D,S,S,D,D,S,3,2,,,,,5M,,B,,5M,,1,,,1,,2,,,,,,,,1,,,1,,,,,6,,_1 3 4 5,,,
185,Ἐκ σέο γὰρ Θεόδωρος ἔχει ζωστῆρα μαγίστρου,Ἐκ σέ#ο γὰρ Θε#ό#δω#ρος ἔ#χει ζωσ#τῆ#ρα μα#γίσ#τρου,,ἐκ σέο γὰρ Θεόδωρος ἔχει ζωστῆρα μαγίστρου,36,3,distih,DDDSDS ,,D,D,D,S,D,S,4,1,,,,3M,,7M,,3M,5F,7M,1,,,,,1,,,,,,,,1,,,,1,,,,7,,_2 5 6,,,
186,Τῆς δ’ εὐγνωμοσύνης μάρτυς γραφίς· ὑμετέρην γὰρ,Τῆς δ’ εὐγ#νω#μο#σύ#νης μάρ#τυς γρα#φίς· ὑ#με#τέ#ρην γὰρ,,τῆς δ’ εὐγνωμοσύνης μάρτυς γραφίς· ὑμετέρην γὰρ,36,5,distih,SDSDDS ,,S,D,S,D,D,S,3,2,,,,,,,B,,5M,7M,,,,1,,1,,,,,,1,,,,,1,,,,,7,,_,,,
187,"Σάλπιγγες, στεροπαί, γαῖα τρέμει· ἀλλ’ ἐπὶ μήτρην","Σάλ#πιγ#γες, στε#ρο#παί, γαῖ#α τρέ#μει· ἀλ#λ’ ἐπὶ μή#τρην",,"Σάλπιγγες, στεροπαί, γαῖα τρέμει· ἀλλ’ ἐπὶ μήτρην",37,1,distih,SDSDDS ,,S,D,S,D,D,S,3,2,,,,3M,5M,,B,3M,5M,7M,,,,1,1,2,,,,,,,1,,,,,1,,,,7,,_1 3 6,,,
188,"Oὐρανὸς ἡ φάτνη, καὶ οὐρανοῦ ἔπλετο μείζων·","Oὐ#ρα#νὸς ἡ φάτ#νη, καὶ οὐ#ρα#νοῦ ἔπ#λε#το μεί#ζων·",,Oὐρανὸς ἡ φάτνη καὶ οὐρανοῦ ἔπλετο μείζων·,38,1,distih,DSSDDS ,,D,S,S,D,D,S,3,2,,,,,5M,,,,5M,,1,,,1,1,3,,,,,,,1,,,,,1,,,,7,,_5 6,,,
189,"Εἷς χορός, ἓν μέλος ἀνθρώποισι καὶ ἀγγελιώταις,","Εἷς χο#ρός, ἓν μέ#λος ἀν#θρώ#ποι#σι καὶ ἀγ#γε#λι#ώ#ταις,",,"Εἷς χορός, ἓν μέλος ἀνθρώποισι καὶ ἀγγελιώταις,",39,1,distih,DDSDDS ,,D,D,S,D,D,S,4,1,,,,,,,,3M,,7F,1,1,,1,,3,,H,,,,,,,,1,,1,,,,7,,_6,,,
190,"Οὐρανὸς ἡ φάτνη, καὶ οὐρανοῦ ἔπλετο μείζων, ","Οὐ#ρα#νὸς ἡ φάτ#νη, καὶ οὐ#ρα#νοῦ ἔπ#λε#το μεί#ζων, ",,"Οὐρανὸς ἡ φάτνη, καὶ οὐρανοῦ ἔπλετο μείζων, ",40,1,hex,DSSDDS ,,D,S,S,D,D,S,3,2,,,,,5M,,,,5M,,1,,,1,1,3,,,,,,,1,,,,,1,,,,7,,"_5, 6",,,
191,οὕνεκεν ὅνπερ ἔδεκτο ἄναξ πέλεν οὐρανιώνων.,οὕ#νε#κεν ὅν#περ ἔ#δεκ#το ἄ#ναξ πέ#λεν οὐ#ρα#νι#ών#ων.,,οὕνεκεν ὅνπερ ἔδεκτο ἄναξ πέλεν οὐρανιώνων.,40,2,hex,DDDDDS ,,D,D,D,D,D,S,5,0,,,,,5F,,,3F,5F,7M,1,,,1,,2,M,,,,,,,,,1,,1,,,,6,,_1 2 6,,,
192,Οὐκέτι δῶρ’ ἀνάγουσι μάγοι πυρὶ ἠελίῳ τε· ,Οὐ#κέ#τι δῶ#ρ’ ἀ#νά#γου#σι μά#γοι πυ#ρὶ ἠ#ε#λί#ῳ τε· ,,Οὐκέτι δῶρ’ ἀνάγουσι μάγοι πυρὶ ἠελίῳ τε· ,41,1,hex,DDDDDT ,,D,D,D,D,D,T,5,0,,,,,,7M,,,5F,7M,1,,,1,,2,,,,,,1,,,,,,,1,,,7,,_2,,,
193,"ἠέλιον γὰρ ἔτευξε τόδε βρέφος, ὡς πυρὸς αὐγάς.","ἠ#έ#λι#ον γὰρ ἔ#τευ#ξε τό#δε βρέ#φος, ὡς πυ#ρὸς αὐ#γάς.",,"ἠέλιον γὰρ ἔτευξε τόδε βρέφος, ὡς πυρὸς αὐγάς.",41,2,hex,DDDDDS ,,D,D,D,D,D,S,5,0,,,,,,,B,3F,5F,7M,,,,1,1,2,,,,,,,1,,,,1,,,,,8,,_,,,
194,"Δέχνυσο, Βηθλεέμ, ὃν προέειπε προφήτης ἐσθλὸς ","Δέχ#νυ#σο, Βηθ#λε#έμ, ὃν προ#έ#ει#πε προ#φή#της ἐσ#θλὸς ",,"Δέχνυσο, Βηθλεέμ, ὃν προέειπε προφήτης ἐσθλὸς ",42,1,hex,DDDDST ,,D,D,D,D,S,T,4,1,1,,,,,,,,5F,7F,1,1,,,1,3,,H,,,,,1,,,,1,,,,,6,,_1 3 ,,,
195,ἵξεσθαι λαῶν ἡγούμενον ἐκ σοῦ ἁπάντων.,ἵ#ξεσ#θαι λα#ῶν ἡ#γού#με#νον ἐκ σοῦ ἁ#πάν#των.,,ἵξεσθαι λαῶν ἡγούμενον ἐκ σοῦ ἁπάντων.,42,2,hex,SSSDDS ,,S,S,S,D,D,S,2,3,,,,,,,B,3M,5M,,,,,1,,1,,,,,,,,1,,,,1,,,,6,,_1 3 4 6,,,
196,"Τίπτε, Ῥαχήλ, γοόωσα πικρὸν κατὰ δάκρυον εἴβεις;","Τίπ#τε, Ῥα#χήλ, γο#ό#ω#σα πι#κρὸν κα#τὰ δάκ#ρυ#ον εἴ#βεις;","Τίπτε, Ῥαχήλ, γόωσα πικρὸν κατὰ δάκρυον εἴβεις;","Τίπτε, Ῥαχήλ, γοόωσα πικρὸν κατὰ δάκρυον εἴβεις; ",43,1,hex,DDDDDS ,,D,D,D,D,D,S,5,0,,,1F,3M,,,,3M,5F,7M,,,,1,1,2,,,,,,,1,,,,,1,,,,7,,_1 2 4 5 6,,,
197,Ὀλλυμένην ὁρόωσα γονὴν κατὰ δάκρυον εἴβω.,Ὀλ#λυ#μέ#νην ὁ#ρό#ω#σα γο#νὴν κα#τὰ δάκ#ρυ#ον εἴ#βω.,,Ὀλλυμένην ὁρόωσα γονὴν κατὰ δάκρυον εἴβω.,43,2,hex,DDDDDS ,,D,D,D,D,D,S,5,0,,,,,,7M,,3M,5F,7M,,,,1,1,2,,,,,,,1,,,,,1,,,,6,,_4 5 6,,,
198,"Χαῖρε, κόρη χαρίεσσα, μακαρτάτη, ἄφθορε νύμφη· ","Χαῖ#ρε, κό#ρη χα#ρί#εσ#σα, μα#καρ#τά#τη, ἄφ#θο#ρε νύμ#φη· ",,"Χαῖρε, κόρη χαρίεσσα, μακαρτάτη, ἄφθορε νύμφη· ",44,1,hex,DDDDDS ,,D,D,D,D,D,S,5,0,,,,,5F,,B,3M,5M,,,,,1,1,2,,,,,,,1,,,,,1,,,,6,,_1 5 6,,,
199,υἷα θεοῦ λαγόνεσσιν ἄτερ πατρὸς ἔμβρυον ἕξεις.,υἷ#α θε#οῦ λα#γό#νεσ#σιν ἄ#τερ πατ#ρὸς ἔμ#βρυ#ον ἕ#ξεις.,,υἷα θεοῦ λαγόνεσσιν ἄτερ πατρὸς ἔμβρυον ἕξεις.,44,2,hex,DDDDDS ,,D,D,D,D,D,S,5,0,,,,,5F,,,3M,5F,,,,,1,1,2,,,,,,,1,,,,,1,,,,7,,_1 2 5 6,,,
200,Ἔνδοθι γαστρὸς ἐὼν σκιρτήμασιν εἶπε προφήτης ,Ἔν#δο#θι γασ#τρὸς ἐ#ὼν σκιρ#τή#μα#σιν εἶ#πε προ#φή#της ,,Ἔνδοθι γαστρὸς ἐὼν σκιρτήμασιν εἶπε προφήτης ,45,1,hex,DDSDDS ,,D,D,S,D,D,S,4,1,,,,,5M,,,3F,5M,,1,,,1,,2,M,,,,,,,1,,,,1,,,,6,,_1 3 4 5 6,,,
201,"σὸν γόνον ὡς θεός ἐστι, καὶ ᾔνεσε πότνια μήτηρ.","σὸν γό#νον ὡς θε#ός ἐσ#τι, καὶ ᾔ#νε#σε πότ#νι#α μή#τηρ.",,"σὸν γόνον ὡς θεός ἐστι, καὶ ᾔνεσε πότνια μήτηρ.",45,2,hex,DDDDDS ,,D,D,D,D,D,S,5,0,,,,,5F,,,3M,5F,,1,1,1,1,1,5,,,,,,,1,,,,,1,,,,9,,_1 4 5 6,,,
202,"Πρεσβύτα, παῖδα δέχοιο, Ἀδὰμ προγενέστερον ὄντα, ","Πρεσ#βύ#τα, παῖ#δα δέ#χοι#ο, Ἀ#δὰμ προ#γε#νέσ#τε#ρον ὄν#τα, ",,"Πρεσβύτα, παῖδα δέχοιο, Ἀδὰμ προγενέστερον ὄντα, ",46,1,hex,DDDDDT ,,D,D,D,D,D,T,5,0,,,,,5F,,,3F,5F,7M,1,,,,1,2,M,,,,,,1,,,,,1,,,,6,,_2 4 5 6,,,
203,ὅς σε βίου λύσει τε καὶ ἐς βίον ἄφθιτον ἄξει.,ὅς σε βί#ου λύ#σει τε καὶ ἐς βί#ον ἄφ#θι#τον ἄ#ξει.,,ὅς σε βίου λύσει τε καὶ ἐς βίον ἄφθιτον ἄξει.,46,2,hex,DSDDDS ,,D,S,D,D,D,S,4,1,,,,,5F,,,3M,5F,,,,1,1,1,3,,,,,,,1,,,,,1,,,,10,,_1 5 6,,,
204,"Πατρὸς ἀπ’ ἀθανάτοιο μέγα σθένος ἤλυθε πνεῦμα, ","Πατ#ρὸς ἀ#π’ ἀ#θα#νά#τοι#ο μέ#γα σθέ#νος ἤ#λυ#θε πνεῦ#μα, ",,"Πατρὸς ἀπ’ ἀθανάτοιο μέγα σθένος ἤλυθε πνεῦμα, ",47,1,hex,DDDDDT ,,D,D,D,D,D,T,5,0,,,,,5F,,,,5F,7M,,1,,1,1,3,,,,,,,1,,,,,,,,1,7,,_5 6,,,
205,υἱὸς ἐπεὶ βαπτίζετ’ Ἰορδάνου ἀμφὶ ῥέεθρα.,υἱ#ὸς ἐ#πεὶ βαπ#τί#ζε#τ’ Ἰ#ορ#δά#νου ἀμ#φὶ ῥέ#ε#θρα.,,υἱὸς ἐπεὶ βαπτίζετ’ Ἰορδάνου ἀμφὶ ῥέεθρα.,47,2,hex,DSDDDT ,,D,S,D,D,D,T,4,1,,,,,5F,,,3M,5F,,,,,1,,1,,,,,,,,1,,,,,1,,,6,,_2 3 ,,,
206,Ἀδὰμ <ἐν> ἦν ζο<φερῷ>..... ,Ἀ#δὰμ <ἐν> ἦν ζο<#φε#ρῷ>..... ,,Ἀδὰμ <ἐν> ἦν ζο<φερῷ>..... ,48,1,hex?,,,D,D,,,,,2,,,,,,,,,,,,,,,,,0,,,,,,,,,,,,,,,,4,,_2 3...,,,
